id,title,description,lib_url,cover_url
63,Бегущий за ветром,"Проникновенная, пробирающая до самого нутра история о дружбе и верности, о предательстве и искуплении. Нежный, ироничный и по-хорошему сентиментальный, роман Халеда Хоссейни напоминает живописное полотно, которое можно разглядывать бесконечно.
История разворачивается в довоенном Кабуле 1970-х. В этом волшебном городе, переливающемся всеми оттенками золота и лазури, живут два мальчика-погодка, Амир и Хасан. Один принадлежал к местной аристократии, другой — к презираемому меньшинству. У одного отец был красив и важен, у другого — хром и жалок. Господин и слуга, принц и нищий, красавец и калека. Но не было на свете людей ближе, чем эти два…",https://www.livelib.ru/book/1002062846-beguschij-za-vetrom-haled-hossejni,https://s1.livelib.ru/boocover/1002062846/o/a014/Haled_Hossejni__Beguschij_za_vetrom.jpeg
64,Простые волшебные вещи ,"Простые волшебные вещи - это такая разновидность магических артефактов. Сделанные вдали от Сердца Мира как простые талисманы, пригодные скорее для спокойствия своего владельца, чем для дела, попадая в Ехо, они внезапно обретают большую силу и удивительные, часто непредсказуемые свойства.

Иногда сэр Макс чувствует себя такой же ""простой волшебной вещью"", от которой никогда не знаешь, чего ожидать.
И никто не знает, вот в чём штука.",https://www.livelib.ru/book/1003992190-prostye-volshebnye-veschi-sbornik-maks-fraj,https://s1.livelib.ru/boocover/1003992190/o/a955/Maks_Fraj__Prostye_volshebnye_veschi_sbornik.jpeg
65,Всё о муми-троллях: повести-сказки ,"Все приключения муми-троллей в одной книге! Здесь вы встретитесь с обитателями сказочной страны - муми-троллями, хатифнаттами, хемулями... Их приключениями зачитывается весь мир. 
Познакомившись с произведениями финской писательницы, вы поймете, почему Янссон так знаменита и почему столь любимы муми-тролли и другие сказочные герои, населяющие ее книги.",https://www.livelib.ru/book/1002090039-vsjo-o-mumitrollyah-povestiskazki-sbornik-tuve-yansson,https://s1.livelib.ru/boocover/1002090039/o/1977/Tuve_Yansson__Vsjo_o_mumitrollyah_povestiskazki_sbornik.jpeg
66,Таинственный остров,"Самыми страшными войнами являются гражданские, когда ненависть зашкаливает все пределы, когда брат идет против брата, когда попасть в плен может быть страшнее смерти. Именно в такой ситуации оказалась пятерка северян, чье стремление к свободе было сильнее страха погибнуть в плену или при попытке к бегству. Но результат бегства на воздушном шаре оказался непредсказуемым: в результате урагана их занесло на необитаемый остров. Множество приключений и опасностей поджидают их там, но отвага, знания и изобретательность позволят им не только уцелеть, но и обустроить свой быт. А остров, только казавшийся необитаемым, на самом деле давно имеет…",https://www.livelib.ru/book/1001530276-tainstvennyj-ostrov-zhyul-vern,https://s1.livelib.ru/boocover/1001530276/o/c0f5/Zhyul_Vern__Tainstvennyj_ostrov.jpeg
67,Поллианна,"Элинор Портер - американская детская писательница, завоевавшая всемирную славу благодаря книге о Поллианне. С тех пор как читатели познакомились с этой обаятельной героиней в 1913 году, книга о ней стала излюбленным чтением для многих поколений девочек.
Одиннадцатилетнюю сироту Поллианну берет на воспитание ее тетя, чопорная старая дева. Поначалу непоседливая и чересчур общительная девочка вызывает у мисс Полли и некоторых других жителей городка недоумение и даже раздражение. Она нарушает всевозможные правила, притаскивает домой котенка, собаку и даже мальчика, сбежавшего из приюта, разговаривает с незнакомцами и всем рассказывает об ""игре…",https://www.livelib.ru/book/1007149603-pollianna-elinor-porter,https://s1.livelib.ru/boocover/1007149603/o/e946/Elinor_Porter__Pollianna.jpeg
68,К оружию! К оружию!,"Ночная Стража переживает ""второе рождение"". И решает проблему с меньшинствами в Анк-Морпорке.

Город Тысячи Сюрпризов приютил мертвого клоуна и взрывающихся драконов. Вечно враждующих гномов и троллей, самого неудачливого воришку во всем Плоском мире. Обладателей ""хорькизмы"" (она же харизма) и знатоков ""башмачной"" теории экономической несправедливости.",https://www.livelib.ru/book/1005550528-k-oruzhiyu-k-oruzhiyu-terri-pratchett,https://s1.livelib.ru/boocover/1005550528/o/d90e/Terri_Pratchett__K_oruzhiyu_K_oruzhiyu.jpeg
69,Братья Карамазовы,"""Братья Карамазовы"" (1880 г.) — последний роман Достоевского, вершина его творчества, в каком-то смысле главный труд всей его жизни и одно из величайших произведений в истории мировой литературы.
Загадка, связанная со смертью и кражей, полная накала и страстей любовная история, разворачивающаяся на глазах читателя семейная драма, сложные психологические перипетии, множество вплетенных в основную канву других остросюжетных линий — все это вместилось в роман ""Братья Карамазовы"", главной проблематикой которого является вопрос о Боге и бессмертии души. А в центре повествования, как всегда у Достоевского, — человек, терзаемый сомнениями,…",https://www.livelib.ru/book/1006032775-bratya-karamazovy-fjodor-dostoevskij,https://s1.livelib.ru/boocover/1006032775/o/cc48/Fjodor_Dostoevskij__Bratya_Karamazovy.jpeg
70,К востоку от Эдема,"""Все, что я написал ранее, в известном смысле было лишь подготовкой к созданию этого романа"", – говорил сам Джон Стейнбек о книге ""К востоку от Эдема"", причем с полным на то основанием: ему удалось создать один из главных литературных шедевров ХХ века.
Роман, спровоцировавший бурю возмущений консервативно настроенных критиков, надолго занял первое место среди национальных бестселлеров.
""К востоку от Эдема"" – книга о страстной любви и ненависти, об ошибках и преступлениях, о доверии и предательстве. В основе сюжета – история двух сыновей калифорнийца Адама Траска, своеобразных Каина и Авеля. Каждый из них ищет свой путь в этом мире и…",https://www.livelib.ru/book/1004638207-k-vostoku-ot-edema-dzhon-stejnbek,https://s1.livelib.ru/boocover/1004638207/o/4832/Dzhon_Stejnbek__K_vostoku_ot_Edema.jpeg
71,Ходячий замок,"Книги английской писательницы Дианы У.Джонс настолько ярки, что так и просятся на экран. По ее бестселлеру ""Ходячий замок"" знаменитый мультипликатор Хаяо Миядзаки (""Унесенные призраками""), обладатель ""Золотого льва"" - высшей награды Венецианского фестиваля, снял анимационный фильм, побивший в Японии рекорд кассовых сборов. 

Софи живет в сказочной стране, где ведьмы и русалки, семимильные сапоги и говорящие собаки - обычное дело. Поэтому, когда на нее обрушивается ужасное проклятие коварной Болотной Ведьмы, Софи ничего не остается, как обратиться за помощью к таинственному чародею Хоулу, обитающему в Ходячем замке. Однако, чтобы…",https://www.livelib.ru/book/1001449815-hodyachij-zamok-diana-uinn-dzhons,https://s1.livelib.ru/boocover/1001449815/o/9247/Diana_Uinn_Dzhons__Hodyachij_zamok.jpeg
72,Повесть о настоящем человеке,"Потрясающая «Повесть о настоящем человеке» Бориса Полевого – это подлинная история военного летчика Алексея Маресьева (в книге – Мересьев), сбитого в воздушном бою и ценой невероятных усилий вернувшегося в строй, преодолевшего обстоятельства, казавшиеся непреодолимыми. Он стал олицетворением русского характера, примером беззаветной преданности Родине. Это повесть о людях, умеющих дружить, любить, сострадать, чья вера в безграничные возможности человеческого духа значила больше, чем победа над врагом.",https://www.livelib.ru/book/1006787095-povest-o-nastoyaschem-cheloveke-boris-polevoj,https://s1.livelib.ru/boocover/1006787095/o/a572/Boris_Polevoj__Povest_o_nastoyaschem_cheloveke.jpeg
73,Восхитительная ведьма,"Пожелайте мне удачи. Я покоряю человека с железным сердцем, каменными плечами и ужасным характером. Я не знаю, чего мне хочется больше — придушить или обнять его.

Он зануда, который старается все делать правильно, но совершает такие безбашенные поступки, на которые я никогда не решилась бы.

Он университетский преподаватель, а я старшекурсница. Пока он не знает, что станет моим парнем. Но ведь это дело времени, правда? Я добьюсь его во что бы то ни стало.",https://www.livelib.ru/book/1003632165-voshititelnaya-vedma-anna-dzhejn,https://s1.livelib.ru/boocover/1003632165/o/4b5c/Anna_Dzhejn__Voshititelnaya_vedma.jpeg
74,С неба упали три яблока ,"История одной маленькой деревни, затерянной высоко в горах, и ее немногочисленных обитателей, каждый из которых немножко чудак, немножко ворчун и в каждом из которых таятся настоящие сокровища духа.",https://www.livelib.ru/book/1002819268-s-neba-upali-tri-yabloka-sbornik-narine-abgaryan,https://s1.livelib.ru/boocover/1002819268/o/d789/Narine_Abgaryan__S_neba_upali_tri_yabloka_sbornik.jpeg
75,Архив Буресвета. Книга 1. Путь королей,"Масштабная сага погружает читателя в удивительный мир, не уступающий мирам Р. Р. Толкиена, Р. Джордана и Р. Сальваторе. Уникальная флора и фауна, тщательно продуманное политическое устройство и богатая духовная культура – здесь нет ничего случайного.

Рошар — мир во власти великих бурь, сметающих все живое на своем пути. Но есть и то, что страшнее любой великой бури, – это истинное опустошение. Одно лишь его ожидание меняет судьбы целых народов. Сумеют ли люди сплотиться перед лицом страшной угрозы? Найдется ли тот, для кого древняя клятва — жизнь прежде смерти, сила прежде слабости, путь прежде цели — станет чем-то большим, нежели…",https://www.livelib.ru/book/1001547246-arhiv-buresveta-kniga-1-put-korolej-brendon-sanderson,https://s1.livelib.ru/boocover/1001547246/o/3ffe/Brendon_Sanderson__Arhiv_Buresveta._Kniga_1._Put_korolej.jpeg
76,"Дядя Федор, пес и кот","Простоквашино — это такое место, где все становятся счастливыми. Дядя Фёдор — потому что у него теперь есть пёс и кот. Матроскин — потому что обзавёлся коровой. Шарик — потому что жизнь сытная и призвание своё он наконец нашёл. И хотя это всё простые радости — читать про счастливых детей и зверей очень приятно.
Для детей до 3-х лет.",https://www.livelib.ru/book/1005644860-dyadya-fedor-pes-i-kot-eduard-uspenskij,https://s1.livelib.ru/boocover/1005644860/o/1848/Eduard_Uspenskij__Dyadya_Fedor_pes_i_kot.jpeg
77,"Люди, которые всегда со мной","""Люди, которые всегда со мной"" - это семейная сага, история нескольких поколений одной семьи. История людей, переживших немало тяжёлых испытаний, но сохранивших в сердце доброту, человечность и любовь друг к другу. Роман о старших, о близких, которые всю жизнь поддерживают нас - даже уже уйдя, даже незримо - и делают нас теми, кто мы есть.
                                                                                 Наринэ Абгарян",https://www.livelib.ru/book/1003262800-lyudi-kotorye-vsegda-so-mnoj-narine-abgaryan,https://s1.livelib.ru/boocover/1003262800/o/6c32/Narine_Abgaryan__Lyudi_kotorye_vsegda_so_mnoj.jpeg
78,Вафельное сердце,"Год из жизни двух жителей бухты Щепки-Матильды, где всего-то три дома, — девятилетнего Трилле, который и рассказывает нам эту историю, и его соседки и одноклассницы Лены — вмещает немыслимо много событий и приключений: забавных, трогательных, опасных... Идиллическое житье-бытье на норвежском хуторе нарушается — но не разрушается — драматическими событиями. Но дружба, конечно же, оказывается сильнее!",https://www.livelib.ru/book/1003621294-vafelnoe-serdtse-mariya-parr,https://s1.livelib.ru/boocover/1003621294/o/1c25/Mariya_Parr__Vafelnoe_serdtse.jpeg
79,Поселок,"Это — книги, от которых не могли и не могут оторваться подростки «всех времен и народов». Это — «Мастера». Мастера лучших фантастических, приключенческих и детективных романов мировой литературы. Великие мастера фантастики братья Стругацкие и СтаниславЛем, Рэй Брэдбери и Кир Булычев... Великие мастера приключенческой прозы — Луи Буссенар, Жюль Верн, Рафаэль Сабатини и Майн Рид... Великие знаменитейшие мастера детектива — от Агаты Кристи до Жоржа Сименона... Каждый читатель — ученик. Ученик мастеров, чьи произведения проверены временем. Ученик мастеров, чьи книги неподвластны старению.

Добро пожаловать на встречу с «Мастерами»!

Это —…",https://www.livelib.ru/book/1000219585-poselok-kir-bulychjov,https://s1.livelib.ru/boocover/1000219585/o/c4f9/Kir_Bulychjov__Poselok.jpeg
80,1984. Скотный Двор ,"«1984». Своеобразный антипод второй великой антиутопии XX века — «О дивный новый мир» Олдоса Хаксли. Что, в сущности, страшнее: доведенное до абсурда «общество потребления» — или доведенное до абсолюта «общество идеи»? По Оруэллу, нет и не может быть ничего ужаснее тотальной несвободы... 

«Скотный Двор». Притча, полная юмора и сарказма. Может ли скромная ферма стать символом тоталитарного общества? Конечно, да. Но... каким увидят это общество его «граждане» — животные, обреченные на бойню?",https://www.livelib.ru/book/1000942736-1984-skotnyj-dvor-sbornik-dzhordzh-oruell,https://s1.livelib.ru/boocover/1000942736/o/fb20/Dzhordzh_Oruell__1984._Skotnyj_Dvor_sbornik.jpeg
81,Перси Джексон и последнее пророчество,"Кронос, собравший огромную армию титанов, хочет захватить и разрушить священный Олимп. На помощь он призвал могущественного великана - Тифона. Боги вступают в сражение с этим страшным противником, оставив без защиты свою обитель. И только Перси Джексон - единственный, кто раскусил военную хитрость Кроноса. Вместе с друзьями-полукровками он встает на защиту Олимпа. Удастся ли им отбить атаки чудовищ или защитникам придется погибнуть в неравном бою? Надеяться они могут только на чудо, а еще на помощь тех богов, кто пока предпочитает не принимать участие в битве.",https://www.livelib.ru/book/1000762632-persi-dzhekson-i-poslednee-prorochestvo-rik-riordan,https://s1.livelib.ru/boocover/1000762632/o/fbe2/Rik_Riordan__Persi_Dzhekson_i_poslednee_prorochestvo.jpeg
82,Манюня пишет фантастичыскый роман,"Перед вами долгожданное продолжение лучшей в мире книги о детстве — романа Наринэ Абгарян ""Манюня"". Всем, кто уже успел узнать и полюбить смешных подружек-хулиганок Нару и Манюню, суровую, но обаятельную Ба — бабушку Манюни и ораву их шумных и несуразных родственников, а также тем, кому это ужасно приятное знакомство только предстоит, мы дарим книжку о новых приключениях Манюни! Если вы думаете, что знаете, на что способны две девчонки младшего школьного возраста, которым не сидится на месте и хочется провести детство так, чтобы ни одна его минута не прошла скучно, то вы еще ничего не знаете... Читайте и ужасайтесь, то есть наслаждайтесь,…",https://www.livelib.ru/book/1002045838-manyunya-pishet-fantastichyskyj-roman-narine-abgaryan,https://s1.livelib.ru/boocover/1002045838/o/eb46/Narine_Abgaryan__Manyunya_pishet_fantastichyskyj_roman.jpeg
83,Поющие в терновнике,"Захватывающая семейная сага, пронзительная история о беспримерной любви длиною в жизнь – роман Колин Маккалоу по праву получил всемирное признание, а блестящая экранизация 1983 года принесла ему еще большую популярность. В этой книге есть все – экзотическая обстановка, неожиданные повороты сюжета, исключительная эмоциональность, тонкие и убедительные психологические портреты. Но прежде всего это подлинный гимн великой любви, во всех ее проявлениях: любви к родной земле, любви к детям и родителям, любви к Богу… и вечной любви мужчины и женщины.",https://www.livelib.ru/book/1003682224-poyuschie-v-ternovnike-kolin-makkalou,https://s1.livelib.ru/boocover/1003682224/o/b76b/Kolin_Makkalou__Poyuschie_v_ternovnike.jpeg
84,Хроники Ехо. Ворона на мосту,"Делая собственную историю чужим достоянием, рассказчик не просто воскрешает ее в памяти, но и в некотором роде заново овеществляет. Она, конечно, и так не выдумка, и все же прежде, до слов, ей недоставало подлинности. В результате совместных усилий рассказчика и слушателя, или читателя на перилах невообразимого Моста Времени одна за другой появляются зримые и осязаемые зарубки.

Поэтому вот вам история о Рыбнике, рыбаке и рыбке, и еще о мокрой вороне, и о конце света заодно, и, если уж на то пошло, — о начале света, и как же хорошо, что у этого слова так много смыслов, как ни поверни, все — правда. Рассказать об этом было почти…",https://www.livelib.ru/book/1002689410-hroniki-eho-vorona-na-mostu-maks-fraj,https://s1.livelib.ru/boocover/1002689410/o/45aa/Maks_Fraj__Hroniki_Eho._Vorona_na_mostu.jpeg
